Question,Answer
"What are your business hours?","Our business hours are Monday to Friday, 9 AM to 6 PM."
"How can I reset my password?","You can reset your password by clicking the 'Forgot Password' link on the login page and following the instructions."
"What payment methods do you accept?","We accept major credit cards (Visa, MasterCard, American Express) and PayPal."
"Where are you located?","Our main office is located at 123 AI Street, Silicon Valley, CA."
"How do I contact customer support?","You can contact customer support by emailing support@example.com or calling us at 1-800-555-1234."
